{
  "schema_version": "catalyst.backtest.trace.v1",
  "policy": {
    "schema_version": "catalyst.backtest.policy.v1",
    "profile": "strict_v1",
    "balance": { "insufficient_balance": "reject" },
    "fills": { "partial_fills": "none", "price_selection": "next_open", "slippage": { "model": "fixed_bps", "bps": "10" }, "fees": { "model": "fixed_bps", "bps": "5" } },
    "gas": { "model": "historical_fee_history", "fallback": { "model": "fixed_usd", "amount": "0.25" } },
    "signals": { "trigger": "crossing", "repeat": "on_each_signal_fire", "cooldown": null },
    "ordering": { "same_tick": "topological_order" },
    "data": { "missing_required": "fail", "missing_optional": "warn" },
    "perps": { "liquidation_check": "every_tick", "funding": "historical", "reduce_only_validation": "strict" },
    "yield": { "accrual": "simple_apr" }
  },
  "interval": "1h",
  "start": "2024-01-01T00:00:00Z",
  "end": "2024-01-01T02:00:00Z",
  "snapshots": [
    { "ts": "2024-01-01T00:00:00Z", "equity_usd": "2000", "portfolio": { "balances": { "base": { "USDC": "1000" }, "hyperliquid": { "USDC": "1000" } }, "perp_positions": [], "yield_positions": [] } },
    { "ts": "2024-01-01T01:00:00Z", "equity_usd": "1999.94", "portfolio": { "balances": { "base": { "USDC": "900", "ETH": "0.0554" }, "hyperliquid": { "USDC": "1000" } }, "perp_positions": [], "yield_positions": [] } }
  ],
  "events": [
    {
      "ts": "2024-01-01T01:00:00Z",
      "type": "signal_fired",
      "node_id": "eth-below-1800",
      "detail": { "symbol": "ETH", "operator": "<", "threshold": "1800", "price": "1800" }
    },
    {
      "ts": "2024-01-01T01:00:00Z",
      "type": "action_executed",
      "node_id": "buy-eth-on-base",
      "detail": { "venue": "base", "symbol": "ETH", "side": "buy", "price": "1801.8", "amount": "0.0554", "value_usd": "100", "fee_usd": "0.05", "gas_usd": "0.02" }
    }
  ],
  "final_portfolio": {
    "balances": { "base": { "USDC": "900", "ETH": "0.0554" }, "hyperliquid": { "USDC": "1000" } },
    "perp_positions": [],
    "yield_positions": []
  },
  "warnings": [],
  "errors": []
}
